{
  "schema_version": "1.0",
  "set_id": "vaidyanad_invoice_v1",
  "domain": "invoice",
  "tenant_id": "vaidyanad",
  "description": "Invoice ID regression (INV-1101) — route, anti-hallucination substrings, retrieval labels via bootstrap.",
  "corpus_fingerprint": "",
  "k_values": [1, 3, 5],
  "cases": [
    {
      "question_id": "inv_1101_route",
      "question": "INV-1101",
      "relevant_chunk_ids": [],
      "expected_answer_substrings": [],
      "forbidden_substrings": [
        "412.50",
        "4537.50",
        "4,537.50",
        "026015079",
        "Corporate Legal Services"
      ],
      "route_hint": "structured",
      "metadata": {
        "skip_retrieval_metrics_if_empty": true,
        "notes": "Phase-5 fabricated values must not appear. Label chunk_ids via bootstrap_golden_chunk_ids.py."
      }
    },
    {
      "question_id": "inv_1101_total",
      "question": "What is the total due on invoice INV-1101?",
      "relevant_chunk_ids": [],
      "expected_answer_substrings": ["INV-1101"],
      "forbidden_substrings": [
        "412.50",
        "4537.50",
        "4,537.50",
        "026015079",
        "Corporate Legal Services"
      ],
      "route_hint": "structured",
      "metadata": {
        "skip_retrieval_metrics_if_empty": true,
        "notes": "Run bootstrap after ingest to populate relevant_chunk_ids for P/R/MRR."
      }
    }
  ]
}
